Title,Location,Details,Size,Timescale,Features,Quote,Quote Attribution
RKD Interiors,"Ballsbridge, Dublin 4","RKD Interiors is a market leading interior architecture firm based in Dublin. The team, led by Justin Treacy, consists of the very best in creative Architects and Interior Designers who work collaboratively with the in-house support team of Designers, Technicians & CAD / BIM Coordinators and the wider resource and expertise of RKD Architects. At the core of their philosophy is a practical and pragmatic approach to delivering the best environments for the most appropriate capital outlay. Having worked with RKD Interiors on numerous occasions in the past, we were aware of the exacting standards that were expected from the outset on this collaboration.

The project was pitched as a real shop window fitout to showcase RKD’s standard and design capability to prospective visiting RKD Clients and we approached the project like any other: to deliver best in market product with zero defects at handover. Covering 6,000 sq ft over 3 floors, the work scope comprised of inspirational studios to the 1st and 2nd floors, with areas designated for collaboration and huddle meetings allowing the designers to get creative with a bespoke staff café, meeting rooms and social spaces based on the Ground Floor.

The overall brief was to produce a comfortable, modern and above all functional workspace with a professional design that exceeds expectations even in an area such as Baggot St. where high end eateries and businesses are the norm. One of the key features, as part of RKD interiors on-going commitment to a greener work environment, was to provide ample, secure bike storage for staff. Not only has this been achieved but it has also become a real design focal point, which upon entry sets a modern and progressive tone. Other features include the herringbone flooring which seamlessly combines durability with design, the increasingly popular crittal glazing and bespoke joinery throughout. In addition, you will find numerous design touches, as you would expect of an RKD interiors design, such as the exposed swag cabling to the lights in the cafe to give the illusion of extra height, the plywood routered RKD logo at entry with integrated shelving and the comfortable lounge located midway through the ground floor.

The project was delivered in 5 weeks following a 1-week pre-construction and mobilisation period.",600m2 over 3 floors,"1-week pre-construction
5 weeks on-site","Bespoke feature joinery and glazed partition packages
Numerous floor finishes running seamlessly throughout
Staff “Cafe”
Internal, secure bike park
2 floors of bright, modern studio space
M&E and IT upgrades throughout
Turnkey furniture package","Working with Sonica was a great experience. We would like to thank the team for delivering for such demanding taskmasters, for working with us to realise and achieve our design in a very tight timeframe, and for making the whole delivery process a thoroughly enjoyable and fun experience for us all.","Liat Greenhot, RKD Interiors"
Fitter Faster Stronger,Leeson Street,"Established only 3-years ago, Fitter Faster Stronger (FFS) is now one of the leading specialist facilities in Dublin providing personal one-on-one or group training across a range of classes and exercise types, from total body strength to full metabolic conditioning.

Having successfully completed FFS’s original gym refurbishment in 2016, and due to their phenomenal expansion and growth, we were delighted to be appointed by the Management Team in FFS to develop and complete their 2nd bespoke premises inside of 18-months.  Working with Courtney McDonnell Design, we were delighted to take on the brief of creating a new space which motivates, engages and pushes personal goals to the highest level whilst also realising the strong branding the FFS model carries.

The space is divided into three main parts – the gym, utility space and break & members areas.  Works included the strip out & demolitions of the entire old premises followed by full M&E installation (to include a DMX programmable lighting system defined by gym instructors to suit mood or event), bespoke feature flooring across different surfaces, extensive landscaping works at the rear gardens to become an outdoor training area, complete joinery co-ordination of utility space and members area and a personalised graphics package to enhance the members workouts and provide guidance through the whole space.
","Complete Basement to Georgian Building, Lesson St.","1-week Pre-construction
6 weeks on-site","Complete strip out of all incumbent areas
Full M&E installation with programmable DMX ambiance lighting
Bespoke feature flooring
Extensive landscaping works to external gym area
D&B joinery & upholstery package
Graphics co-ord and installation","The level of professionalism and proficiency on the first project we carried out with Sonica Fitout really impressed us, hence the reason why we went back to them for our 2nd premises. The entire fitout was completed on an aggressive timeline with multiple moving parts, but the team here at FFS are once again delighted with the finished product that was achieved, it looks awesome!","Rory McInerney, Managing Director, FFS"
Private Client,"East Point Business Park, Dublin 3","Sonica Fitout was appointed by CBRE to act as Main Contractor for the refurbishment and upgrade of this 5th floor Corporate office space located at East Point Business Park in Dublin.

The Client’s fitout requirements were driven by an internal review to develop new ways of working. The challenge was to take these findings and ideas and bring them into a layout scheme that realised all their requirements whilst also increasing headcount within the floor space. Our project brief then consisted of the demolition and re-build of the existing layouts, installation of new branded specialist joinery items throughout the floor, a vibrant colour theming and graphics package co-ordination, installation of new glazed partitions including folding walls with modifications to the existing data infrastructure and the mechanical and electrical services of the space.

The completed office space now promotes the Client’s identity and provides a new fresh working space for staff.","1,500m2","2-week Pre-Construction
5 weeks Build Management On-Site","Extensive Feature Joinery Package
Data Infrastructure Installation
M&E Services Modification
Numerous Floor Finishes running seamlessly throughout
Corporate Signage & Brand Identity",,
M & S Simply Food,Dublin 8,"M&S Simply Food are an off-shoot of the famous high street British multinational specialising on high quality grab-and-go ready meal ranges and every day food selections.

This project consisted of the fitout from shell and core of the new M&S Simply Food outlet in Dublin’s Heuston Train Station. Works revolved around the installation of new M&E services, flooring, internal partitions, decorations, PoS counters, feature joinery, product refrigeration, the co-ordination of Client direct vendors and the installation of internal and external corporate graphics.

A carefully considered site management & works execution plan was key to the success of the project with close co-ordination with Station management while works progressed in the busy station.",200m2,"1-week Pre-construction
5 weeks on-site","New M&E services installation
Feature joinery package
M&S corporate graphics install
Exposed ceilings throughout
LIVE station working environment
Client Direct vendor management","Just a quick note to compliment and acknowledge the efforts of your Team on the Heuston Station M&S project. These types of projects are not simple, particularly from a co-ordination view point, but your Team demonstrated professionalism and proactive thinking in dealing with any issue that arose and delivered the project on programme. It has been great working with you right through the project and we look forward to working with Sonica again in the future.","Stephen Crean, Linesight PM"
Wipro,Ballsbridge,"Since entering the Irish market in 2015, WIPRO have gone from strength to strength securing substantial projects for their ever increasing Client base. This success has been met with a rapid increase in head count and exponential office space requirement.

Having just completed their initial 30k sq.ft. office in Dublin’s Elm Park in 2015, we were delighted to build upon and advance the great working relationship we had developed with both their International and Local Teams when they appointed us again as their Turnkey D&B Fitout Specialist for their new expansion offices in Ballsbridge.

The brief was to capture the look and feel of what we had been previously delivered for them on the Elm Park project, but to take that blue print and move it on to the next level again – no easy task if you were to look at the completed space in Elm Park!

At 20k sq.ft. and running concurrently over two floors, works were undertaken in a multi-tenanted office development with continual intensive daily co-ordination with the sitting Campus Management Team. Added to the time sensitive nature of the project was the Client’s “not-to-exceed” occupation date which was a key consideration in our aggressive construction programme.

Due to the high degree of cellularisation to form the various offices, meeting spaces, VC Rooms & Executive Boardrooms, the mechanical scope required considerable addition to the primary Landlord ventilation provisions via. intensive upgrades, modelling and building control integration.

The project scope also included a large specialist joinery component, an extensive canteen space with exposed ceilings and feature lighting throughout, bespoke reception area, feature hard and soft floorings, substantial active IT solution, a fully redundant IT backbone install with UPS back up to main comms room, high-end Corporate level access control and security install, A/V delivery and a full furniture installation across the complete dual floor plate.

We wish Wipro continued success in their newest home and look forward to representing them again in their next round of expansions.","2,000m2","6 weeks design
4 weeks pre-con
10 weeks on-site","Sonica PM
Full Design Realisation and Co-ordination with International Design Team
Landlord Approval and Grant of Licence to Alter
Local Design Team Appointment & Management as Lead Consultant
Complete Project Financial Control & Package Management
Client Direct Vendor Engagement and Management
Staff Migration & Move Management","The bittersweet time has come to say thank you and farewell (albeit for now!) to the formidable & fantastic team that is Sonica. We can’t thank you enough for your dedication, enthusiasm and flexibility over the last year. We have worked together through different time zones, deadlines and (at times!) style preferences to ultimately create two unique Office environments which epitomise the Spirit of Wipro.

Thanks for sharing your vision with us and for the friendship that we’ve formed.","Trish Buckley, Admin. Manager, WIPRO Europe"
Anya Hindmarch,Kildare Village,"Founded in 1987, Anya Hindmarch has grown into a global brand with more than 45 stores including flagship outlets in New York, London, Tokyo and LA. Known for blending wit and creativity with the finest craftsmanship and innovative leatherwork techniques, they are stocked in many of the world’s best retail stores, from Barney’s in New York to BoonTheShop in Korea.

Following receipt of our outline brief, we were appointed to create a unique, bespoke new store for the brand in Kildare Village coupled with the strip out, surrender and relocation of the existing store within the campus. The new store was a complete turn key fitout from “grey box” to open for business. The works comprised of new flooring details, changing room marketing and sales displays and complete joinery coordination as well as mechanical and electrical installation.

The completed project reflects Anya Hindmarch’s extraordinary identity with strong emphasis on minimalistic detail and a high level of finishes throughout.",100m2,"1-week pre-construction
8 weeks on-site","Extensive feature joinery package
Stunning solid oak herringbone flooring
Bespoke glazed partition solution
M&E and IT upgrades throughout
Live Building working environment
Turnkey furniture package and Client migration",,
Private Client,Citywest,"We are delighted to showcase the successful completion of a new 30k sq.ft. Corporate HQ office in Dublin’s Citywest Business Campus for a Private Sonica Client, the results of which are absolutely stunning.

Our brief took the project from an existing Landlord CAT-A finish (which was fully stripped out) to their fitted out Corporate HQ in 14 weeks from appointment.

Works were undertaken in a multi-tenanted office development with continual intensive daily co-ordination with the sitting Campus Management Team. Added to the time sensitive nature of the project was the Client’s “not-to-exceed” occupation date which was a key consideration in our aggressive construction programme.

Due to the high degree of cellularisation to form the various offices, meeting spaces and executive boardrooms, the mechanical scope required considerable addition to the primary Landlord ventilation provisions via. intensive upgrades, modelling and building control integration.

The project scope also included a large specialist joinery component, an extensive “Town Hall” meeting space with feature exposed ceilings and feature lighting throughout, bespoke reception area, feature hard and soft floorings, substantial active IT solution, a fully redundant IT backbone install with UPS back up to main comms room, gymnasium installation, high-end Corporate level access control and security install, A/V delivery and a full furniture installation across the complete floor plate.","3,000m2","4 weeks pre-construction
10 weeks on site","Design and VE development to suit budget parameters
International collaboration with multiple project stakeholders
Co-ordination with local Team on relocation deliverables
Comms room commissioned and complete 2 weeks before handover to allow Client IT access.",,
AIG,"IFSC, Dublin","AIG Europe Limited is a provider of innovative products and services, including car, property, travel, health and identity theft insurance products to more than half of the country’s top 100 companies as well as many public and private sector organisations and tens of thousands of individuals. They are also the proud main sponsor of the Dublin GAA Team #BackingEveryStep

Working in their Irish HQ offices in the IFSC, our brief comprised of the removal and replacement of the complete existing building ventilation system followed by retro-install of a new AC system with associated architectural and electrical works. The brief also included a full upgrade of all WCs throughout the building, installation of new mechanical chilling plant at roof level, a fixed line system for roof access, Landlord common area refurbishment and a complete re-design and fitout of the 3rd Floor office space. All works were conducted within a live, fully occupied building environment.

The new office design placed emphasis on increased Team collaboration with all new open plan workstations, meeting rooms, offices, boardrooms, flexible spaces, staff kitchens & canteen areas, breakout areas and a number of bespoke “Tech Bars” all part of the required brief.

Effective use of space was an issue in the previous office so the new office was designed with ample storage capabilities to reduce clutter. The overall look and feel of the completed offices are fresh, professional and welcoming with spectacular views across Dublin city.

The whole project was completed within the agreed tender time frame of 22 weeks.","8,000m2",22 weeks on site,"Variety of work settings and collaboration spaces
Extensive M&E Remodel & Upgrade
High quality joinery
Works in fully occupied building over 5-floor plates
Management of Client Direct vendors into master programme of works","On behalf of the PM team, I would like to convey our thanks to the Sonica team for a job well done. A special word of thanks to your Construction Manager, Ray McCaul, for his 100% commitment in achieving PC. This was a challenging project on a number of fronts and this achievement is not to be underestimated.","Allan Murphy, Director, Scott-Murphy. Client PM"
Sonica Fitout,"Kingram Place, Dublin 2","We are delighted to showcase the completion of our new Head Office in Kingram Place, at the heart of Fitzwilliam Square in Dublin City Center.

Works commenced in January 2016 and were completed in a hugely impressive 5-week programme led by our D&B CM Colin Kirwan. Calling on our most trusted of trade contract partners, we have succeeded in creating what we feel is an office that’s truly worthy of the people that occupy it. It is everything we are as a Company: unique, unconventional, unexpected, refreshingly modern and forward thinking.

The fitout is nothing short of breath taking. Justin Treacy and Liat Greenhot of RKD Interiors have taken the vibrancy and energy of the Sonica brand and brought it to life with a myriad of individual features and wonderful ideas. From the floor-to-ceiling trapezoidal wall panelled boardroom to a 10m long 3-D snake bench with over 300 individually milled vertical components in the Ops Area, there is simply nothing like it in the City.

We can’t wait to show you around what is a great place to work and even better place to visit!",350m2,5 weeks on site,"Unique custom made trapezoidal Boardroom wall panelling
Completely bespoke joinery throughout the entire office
Feature operator workstation desking & storage units
Wifi controlled lighting control system for user defined mood and colour settings
Extensive graphics and artwork package
Custom laid vinyl plank flooring to feature guest Reception
Complete A/V solution to Boardroom, Breakouts and Reception.","This office is our showroom, our statement of ""Hey, look what we can do!"" and it does that all in spades. We love seeing peoples reactions when they visit because they are just simply blown away with the ideas and concepts, the intricacies of the work and the overall finished product. In almost 20-years of fitout, I'm happy to say there is simply nothing like it anywhere else, which is what we at Sonica are all about.","Donnacha Neary, Managing Director"
Ellucian,"Marine House, Dublin 2","Ellucian provide the software, services and analytics needed to manage campus businesses faster, easier and more effectively. Serving 2,400 institutions in 40 countries across the globe, they selected Sonica Fitout as their partner for the fitout of their new Irish HQ in Dublin.

The project commenced with the demolition and strip out of existing finishes and M&E services on one of the upper floors of this multi-tenanted, fully occupied live building. The pre-planning and logistical management of this significant operation ran hand-in-hand with the simultaneous upfront procurement of specialist packages required for the fitout.

The intricate design of the space encompassed features on all flat surfaces, from the multi-layered flooring finishes to the varied hard and soft textures on partitions and walls throughout. The open plan desking has privacy screens and operator chairs matched with selected fabrics to accentuate the colour scheme of the Company’s brand. Ceilings were a blend of exposed concrete slabs interspersed with raft formed lay in grids to pick out areas below. A full M&E, IT and A/V brief fell under our remit with Sonica also co-ordinating the Client furniture delivery, load-out and installation.

The completed space gives staff the use of finished huddle rooms, spacious canteens and tea stations, open collaboration areas, V-Con Rooms, Exec Boardrooms and quiet cellular offices. The project was delivered on-programme and within the agreed Contract Sum. More importantly, it was a hugely enjoyable experience for us thanks to a fantastic Client that empowered their Design Team to “go big” with their imagination and trusted us to realise their vision for the completed work space.

The end product is truly spectacular, one that we are hugely proud of and delighted to show case.",1000m2 floor plate,7 weeks on-site from start to full Client occupation,"Substantial feature joinery package
Acoustically rated glazed partition solution with bespoke manifestations
Complete M&E refit with Data / Active IT rewire part of brief
Multiple floor finishes, hard and soft
Co-ordination with sitting tennants and Landlord teams all through construction
Snag free hand back",A very detailed piece of work taken on and delivered against an aggressive programme driven by our Client's not to be missed occupational requirements. You guys made it all look easy.,"Neil McGovern, Project Manager & Client Rep. Jones Lang LaSalle"
Ticket Master,"Grafton House, Grafton Street","Ticketmaster is the world’s largest ticket distribution company, providing event tickets for more than 10,000 Promotors whose productions range from professional wrestling matches and rock concerts to Broadway shows and operas.

Our brief was to deliver a vibrant and invigorating work space for the Company’s employees at the new Ticketmaster Ireland HQ.  The works entailed the fit-out to an existing unit which involved strip out and demolitions of the previously occupied space, the installation of all new wall partitions, floor finishes, internal decoration, M&E service installations and a complete office furniture solution.  The design of the working environment is predominantly open plan to allow for collaborative interaction and employee connectivity, but strategically placed workstations and cellular meeting spaces ensure that teams retain their structure within the overall environment.

Features of the design include a spacious staff kitchen and breakout area, a specialised digital meeting / training room, boardroom, numerous meeting rooms, a secure ticket print / store room and a reception area with “Bolon” wall and bespoke desk.  In keeping with Ticketmasters corporate brand identity, large scale graphics fill the walls at every vantage point, reinforcing the culture of the company and adding energy and colour to the space.

The project was delivered in 6 weeks following an accelerated pre-construction and mobilisation period to meet the Clients set in stone move in date.
",600m2,"2 weeks pre-con
6 weeks on site","Bespoke specialised joinery with numerous unique finishes and materials
International collaboration with Ticket Master’s overseas steering group
Corporate signage & brand identity
Management of Client direct vend packages",,
Wipro,"Elm Park, Dublin","Wipro Ltd is a global information technology, consulting and outsourcing company with 158,217 employees serving clients in 175+ cities across 6 continents. The company posted revenues of $7.5 billion for the financial year ended Mar 31, 2015.

Following their announcement to move into the Irish market, they selected Sonica as their turn key D&B contractor for the design and fitout of their new 240-seater office in the spectacular Elm Park OBA in Dublin.

Our Design and Build brief took the project from initial space planning for Lease negotiation, to Landlord consent phase, through to detailed design, costing, planning, constructing and overall hand-back. The complete project life cycle, managed from start-to-finish by Sonica.

Works were undertaken in the top 3-floors of the OBA building with management of logistics and daily co-ordination with the sitting Building Management Team a key consideration in the development of our aggressive construction programme.

A high degree of cellularisation in forming the various manager offices, meeting spaces, huddle rooms and executive boardrooms required considerable addition to the Landlords naturally conditioned eco-building ventilation strategy via. intensive modelling and BMS integration. The project scope also included a large specialist joinery component, stone flooring, substantial active IT solution, a fully redundant IT backbone install, Comms Room UPS, digital monitoring, building security, A/V delivery and a complete furniture installation across 3-floor plates.

The project was run with fully transparent financials, with the Client retaining all expenditure authorisation throughout the build process via their internationally issued PO’s. The completed works were delivered below the original approved budget tabled at Design completion stage.","3,000m2","6 weeks design
8 weeks on site","International collaboration at design phase to achieve Client design goals.
Open plan financials with project delivered on time and below budget.
Comms room commissioned and complete 3 weeks before handover to allow Client IT access.
Client direct vendors were managed into our overall programme to ensure complete co-ordination of overall project completion.",Every member of their Project Delivery Team remained a hugely visible resource to us all through the complete project life cycle and the final results speak for themselves. We cannot speak highly enough of the manner in which they completed this project.,"Paul Quinn, BKD Architects."
